[
  {
    "id": "src-congress-oral-history",
    "title": "Civil Rights History Project Oral Histories",
    "type": "archive",
    "url_or_citation": "Library of Congress Civil Rights oral histories"
  },
  {
    "id": "src-sncc-archive",
    "title": "SNCC and Freedom Rides Historical Timeline",
    "type": "timeline",
    "url_or_citation": "SNCC Digital Gateway timeline references"
  },
  {
    "id": "src-tennessean-1961-05-18",
    "title": "The Tennessean report on Freedom Ride continuation",
    "type": "newspaper",
    "url_or_citation": "The Tennessean, 1961-05-18 coverage of Nashville student riders resuming the Freedom Ride"
  },
  {
    "id": "src-arsenault-freedom-riders",
    "title": "Freedom Riders: 1961 and the Struggle for Racial Justice",
    "type": "book",
    "url_or_citation": "Arsenault, Raymond. Freedom Riders: 1961 and the Struggle for Racial Justice."
  }
]